{
  "schema_version": "0.1.0",
  "proposed_reassessments": [
    {
      "finding_id": "finding-11111111-1111-4111-8111-111111111111",
      "assessment": {
        "candidate_id": "c1",
        "status": "invalid",
        "reason": "Proposed hypothesis: the route converter rejects invalid identifiers before the handler.",
        "evidence": [
          {
            "kind": "code",
            "explanation": "The new endpoint converts untrusted text with int() without handling ValueError.",
            "source_ids": [
              "code-head"
            ],
            "location": {
              "path": "app/views.py",
              "start_line": 21,
              "end_line": 23,
              "side": "RIGHT",
              "revision_role": "head"
            },
            "artifact_id": null
          }
        ],
        "missing_evidence": [],
        "resolution_needed": null,
        "suggestion_assessment": "not_provided",
        "invalid_reason": "refuted"
      },
      "source_comment_ids": [
        "author-reply"
      ],
      "draft_replies": [
        {
          "reply_target_id": "reply-finding-11111111-1111-4111-8111-111111111111",
          "body": "The route converter appears to reject invalid identifiers before the handler; this proposal requires independent verification."
        }
      ]
    }
  ],
  "limitations": [],
  "closed_finding_decisions": []
}
